[
  {
    "id": "UT-001",
    "name": "testValidateUserCredentials",
    "type": "UNIT",
    "description": "Unit test to verify that user credentials are properly validated against the authentication system",
    "trace": ["33", "32"],
    "filename": "AuthenticationTests.cs",
    "purpose": "Verify that the validateCredentials method correctly identifies valid and invalid user credentials",
    "acceptance": "Method returns true for valid credentials and false for invalid credentials, with appropriate logging"
  },
  {
    "id": "UT-002",
    "name": "testPasswordEncryption",
    "type": "UNIT",
    "description": "Unit test to ensure passwords are encrypted using the correct algorithm and salt",
    "trace": ["29", "28"],
    "filename": "SecurityTests.cs",
    "purpose": "Validate that password encryption follows security standards and produces consistent results",
    "acceptance": "Encrypted password matches expected hash format and can be verified against original password"
  },
  {
    "id": "UT-003",
    "name": "testDatabaseConnectionHandling",
    "type": "UNIT",
    "description": "Unit test for database connection establishment and error handling",
    "trace": ["26"],
    "filename": "DatabaseTests.cs",
    "purpose": "Ensure database connections are properly established and handle connection failures gracefully",
    "acceptance": "Connection succeeds with valid parameters, throws appropriate exceptions for invalid parameters"
  },
  {
    "id": "UT-004",
    "name": "testUserInputValidation",
    "type": "UNIT",
    "description": "Unit test to validate user input sanitization and validation rules",
    "trace": ["12", "10"],
    "filename": "ValidationTests.cs",
    "purpose": "Verify that all user inputs are properly sanitized to prevent injection attacks",
    "acceptance": "Invalid inputs are rejected with clear error messages, valid inputs pass through unchanged"
  },
  {
    "id": "UT-005",
    "name": "testSessionManagement",
    "type": "UNIT",
    "description": "Unit test for user session creation, validation, and cleanup",
    "trace": ["5", "4"],
    "filename": "SessionTests.cs",
    "purpose": "Ensure user sessions are properly managed throughout the application lifecycle",
    "acceptance": "Sessions are created with unique IDs, expire after timeout, and are properly cleaned up"
  },
  {
    "id": "UT-006",
    "name": "testConfigurationLoader",
    "type": "UNIT",
    "description": "Unit test for application configuration loading and parsing",
    "trace": ["3"],
    "filename": "ConfigurationTests.cs",
    "purpose": "Validate that application configuration is loaded correctly from various sources",
    "acceptance": "Configuration values are loaded with correct types and defaults are applied when values are missing"
  }
]